{
  "$schema": "https://json-schema.org/draft/2020-12/schema",
  "title": "Analyzer V5 heroes/latest.json",
  "type": "object",
  "additionalProperties": false,
  "required": ["schema_version", "kind", "generated_at", "window", "days"],
  "properties": {
    "schema_version": {"const": 1},
    "kind": {"const": "hero_metrics"},
    "generated_at": {"type": "string", "pattern": "^\\d{4}-\\d{2}-\\d{2}T\\d{2}:\\d{2}:\\d{2}Z$"},
    "window": {"$ref": "#/$defs/window"},
    "days": {
      "type": "array",
      "minItems": 1,
      "maxItems": 7,
      "items": {
        "type": "object",
        "additionalProperties": false,
        "required": ["day", "rows"],
        "properties": {
          "day": {"$ref": "#/$defs/day"},
          "rows": {
            "type": "array",
            "minItems": 16,
            "maxItems": 16,
            "items": {"$ref": "#/$defs/row"}
          }
        }
      }
    }
  },
  "allOf": [
    {
      "if": {"properties": {"window": {"properties": {"days": {"const": 1}}}}},
      "then": {"properties": {"days": {"minItems": 1, "maxItems": 1}}}
    },
    {
      "if": {"properties": {"window": {"properties": {"days": {"const": 2}}}}},
      "then": {"properties": {"days": {"minItems": 2, "maxItems": 2}}}
    },
    {
      "if": {"properties": {"window": {"properties": {"days": {"const": 3}}}}},
      "then": {"properties": {"days": {"minItems": 3, "maxItems": 3}}}
    },
    {
      "if": {"properties": {"window": {"properties": {"days": {"const": 4}}}}},
      "then": {"properties": {"days": {"minItems": 4, "maxItems": 4}}}
    },
    {
      "if": {"properties": {"window": {"properties": {"days": {"const": 5}}}}},
      "then": {"properties": {"days": {"minItems": 5, "maxItems": 5}}}
    },
    {
      "if": {"properties": {"window": {"properties": {"days": {"const": 6}}}}},
      "then": {"properties": {"days": {"minItems": 6, "maxItems": 6}}}
    },
    {
      "if": {"properties": {"window": {"properties": {"days": {"const": 7}}}}},
      "then": {"properties": {"days": {"minItems": 7, "maxItems": 7}}}
    }
  ],
  "$defs": {
    "count": {"type": "integer", "minimum": 0},
    "day": {"type": "string", "pattern": "^\\d{4}-\\d{2}-\\d{2}$"},
    "window": {
      "type": "object",
      "additionalProperties": false,
      "required": ["start", "end", "days"],
      "properties": {
        "start": {"$ref": "#/$defs/day"},
        "end": {"$ref": "#/$defs/day"},
        "days": {"type": "integer", "minimum": 1, "maximum": 7}
      }
    },
    "row": {
      "type": "object",
      "additionalProperties": false,
      "required": ["hero", "segment", "runs", "outcomes", "ten_win_days", "matchups"],
      "properties": {
        "hero": {"enum": ["Dooley", "Jules", "Karnok", "Mak", "Pygmalien", "Stelle", "TheDragons", "Vanessa"]},
        "segment": {"enum": ["legend", "non_legend"]},
        "runs": {
          "type": "object",
          "additionalProperties": false,
          "required": ["completed", "scored", "ten_win"],
          "properties": {
            "completed": {"$ref": "#/$defs/count"},
            "scored": {"$ref": "#/$defs/count"},
            "ten_win": {"$ref": "#/$defs/count"}
          }
        },
        "outcomes": {
          "type": "object",
          "additionalProperties": false,
          "required": ["perfect", "gold", "silver", "bronze"],
          "properties": {
            "perfect": {"$ref": "#/$defs/count"},
            "gold": {"$ref": "#/$defs/count"},
            "silver": {"$ref": "#/$defs/count"},
            "bronze": {"$ref": "#/$defs/count"}
          }
        },
        "ten_win_days": {
          "type": "object",
          "additionalProperties": false,
          "required": ["known_count", "sum_days"],
          "properties": {
            "known_count": {"$ref": "#/$defs/count"},
            "sum_days": {"$ref": "#/$defs/count"}
          }
        },
        "matchups": {
          "type": "array",
          "items": {
            "type": "object",
            "additionalProperties": false,
            "required": ["opponent_hero", "decided", "wins", "losses"],
            "properties": {
              "opponent_hero": {"enum": ["Dooley", "Jules", "Karnok", "Mak", "Pygmalien", "Stelle", "TheDragons", "Vanessa"]},
              "decided": {"type": "integer", "minimum": 1},
              "wins": {"$ref": "#/$defs/count"},
              "losses": {"$ref": "#/$defs/count"}
            }
          }
        }
      }
    }
  }
}
