{"days":[{"day":"2026-08-10","rows":[{"hero":"Dooley","matchups":[{"decided":13,"losses":0,"opponent_hero":"Pygmalien","wins":13}],"outcomes":{"bronze":0,"gold":0,"perfect":11,"silver":1},"runs":{"completed":12,"scored":12,"ten_win":11},"segment":"legend","ten_win_days":{"known_count":11,"sum_days":110}},{"hero":"Dooley","matchups":[],"outcomes":{"bronze":0,"gold":0,"perfect":0,"silver":0},"runs":{"completed":0,"scored":0,"ten_win":0},"segment":"non_legend","ten_win_days":{"known_count":0,"sum_days":0}},{"hero":"Jules","matchups":[{"decided":5,"losses":0,"opponent_hero":"Pygmalien","wins":5}],"outcomes":{"bronze":0,"gold":0,"perfect":4,"silver":1},"runs":{"completed":5,"scored":5,"ten_win":4},"segment":"legend","ten_win_days":{"known_count":4,"sum_days":106}},{"hero":"Jules","matchups":[],"outcomes":{"bronze":0,"gold":0,"perfect":0,"silver":0},"runs":{"completed":0,"scored":0,"ten_win":0},"segment":"non_legend","ten_win_days":{"known_count":0,"sum_days":0}},{"hero":"Karnok","matchups":[],"outcomes":{"bronze":0,"gold":0,"perfect":0,"silver":0},"runs":{"completed":0,"scored":0,"ten_win":0},"segment":"legend","ten_win_days":{"known_count":0,"sum_days":0}},{"hero":"Karnok","matchups":[],"outcomes":{"bronze":0,"gold":0,"perfect":0,"silver":0},"runs":{"completed":0,"scored":0,"ten_win":0},"segment":"non_legend","ten_win_days":{"known_count":0,"sum_days":0}},{"hero":"Mak","matchups":[{"decided":1,"losses":0,"opponent_hero":"Pygmalien","wins":1}],"outcomes":{"bronze":0,"gold":0,"perfect":1,"silver":0},"runs":{"completed":1,"scored":1,"ten_win":1},"segment":"legend","ten_win_days":{"known_count":1,"sum_days":10}},{"hero":"Mak","matchups":[],"outcomes":{"bronze":0,"gold":0,"perfect":0,"silver":0},"runs":{"completed":0,"scored":0,"ten_win":0},"segment":"non_legend","ten_win_days":{"known_count":0,"sum_days":0}},{"hero":"Pygmalien","matchups":[],"outcomes":{"bronze":0,"gold":0,"perfect":0,"silver":0},"runs":{"completed":0,"scored":0,"ten_win":0},"segment":"legend","ten_win_days":{"known_count":0,"sum_days":0}},{"hero":"Pygmalien","matchups":[],"outcomes":{"bronze":0,"gold":0,"perfect":0,"silver":0},"runs":{"completed":0,"scored":0,"ten_win":0},"segment":"non_legend","ten_win_days":{"known_count":0,"sum_days":0}},{"hero":"Stelle","matchups":[{"decided":1,"losses":0,"opponent_hero":"Pygmalien","wins":1}],"outcomes":{"bronze":0,"gold":0,"perfect":1,"silver":0},"runs":{"completed":1,"scored":1,"ten_win":1},"segment":"legend","ten_win_days":{"known_count":1,"sum_days":10}},{"hero":"Stelle","matchups":[],"outcomes":{"bronze":0,"gold":0,"perfect":0,"silver":0},"runs":{"completed":0,"scored":0,"ten_win":0},"segment":"non_legend","ten_win_days":{"known_count":0,"sum_days":0}},{"hero":"TheDragons","matchups":[{"decided":1,"losses":0,"opponent_hero":"Pygmalien","wins":1}],"outcomes":{"bronze":0,"gold":0,"perfect":1,"silver":0},"runs":{"completed":1,"scored":1,"ten_win":1},"segment":"legend","ten_win_days":{"known_count":1,"sum_days":10}},{"hero":"TheDragons","matchups":[],"outcomes":{"bronze":0,"gold":0,"perfect":0,"silver":0},"runs":{"completed":0,"scored":0,"ten_win":0},"segment":"non_legend","ten_win_days":{"known_count":0,"sum_days":0}},{"hero":"Vanessa","matchups":[{"decided":6,"losses":1,"opponent_hero":"Pygmalien","wins":5}],"outcomes":{"bronze":1,"gold":1,"perfect":3,"silver":0},"runs":{"completed":7,"scored":7,"ten_win":4},"segment":"legend","ten_win_days":{"known_count":4,"sum_days":40}},{"hero":"Vanessa","matchups":[{"decided":1,"losses":1,"opponent_hero":"Pygmalien","wins":0}],"outcomes":{"bronze":0,"gold":0,"perfect":0,"silver":0},"runs":{"completed":1,"scored":1,"ten_win":0},"segment":"non_legend","ten_win_days":{"known_count":0,"sum_days":0}}]}],"generated_at":"2026-08-11T00:30:00Z","kind":"hero_metrics","schema_version":1,"window":{"days":1,"end":"2026-08-10","start":"2026-08-10"}}
